{
  "$schema": "https://json-schema.org/draft/2020-12/schema",
  "$id": "https://agentlens.dev/schemas/agentlens.final.v1.json",
  "$comment": "v1 is locked. Breaking changes require v2 namespace.",
  "title": "agentlens.final.v1",
  "type": "object",
  "additionalProperties": false,
  "required": [
    "schema",
    "run_id",
    "ended_at",
    "agent_outcome",
    "summary",
    "changed_files",
    "verification",
    "residual_risks"
  ],
  "properties": {
    "schema": {
      "type": "string",
      "const": "agentlens.final.v1"
    },
    "run_id": {
      "type": "string"
    },
    "ended_at": {
      "type": "string",
      "pattern": "^\\d{4}-\\d{2}-\\d{2}T\\d{2}:\\d{2}:\\d{2}(\\.\\d+)?Z$"
    },
    "agent_outcome": {
      "type": "string",
      "enum": ["success", "failed", "partial", "cancelled", "unknown"]
    },
    "summary": {
      "type": "string",
      "maxLength": 4096
    },
    "changed_files": {
      "type": "array",
      "items": {
        "type": "object",
        "additionalProperties": false,
        "required": ["path_label", "path_hash"],
        "properties": {
          "path_label": {
            "type": "string"
          },
          "path_hash": {
            "type": "string",
            "pattern": "^sha256:[a-f0-9]{64}$"
          }
        }
      }
    },
    "verification": {
      "type": "array",
      "items": {
        "type": "object",
        "additionalProperties": false,
        "required": ["kind", "command_hash", "status", "excerpt"],
        "properties": {
          "kind": {
            "type": "string",
            "enum": ["command", "test", "manual"]
          },
          "command_hash": {
            "type": "string",
            "pattern": "^sha256:[a-f0-9]{64}$"
          },
          "status": {
            "type": "string",
            "enum": ["passed", "failed", "skipped"]
          },
          "excerpt": {
            "type": "string",
            "maxLength": 4096
          }
        }
      }
    },
    "residual_risks": {
      "type": "array",
      "items": {
        "type": "object",
        "additionalProperties": false,
        "required": ["severity", "summary"],
        "properties": {
          "severity": {
            "type": "string",
            "enum": ["low", "medium", "high", "critical"]
          },
          "summary": {
            "type": "string",
            "maxLength": 4096
          }
        }
      }
    },
    "exit_signal": {
      "type": "string",
      "enum": ["SIGINT", "SIGTERM", "SIGHUP", "other"]
    },
    "exit_code": {
      "type": "integer"
    },
    "no_changes_reason": {
      "type": "string",
      "maxLength": 4096
    }
  }
}
