{
  "schema": "agentlens.final.v1",
  "run_id": "run_20260101_000000_aaaaaa",
  "ended_at": "2026-01-01T00:00:05Z",
  "agent_outcome": "success",
  "summary": "minimal successful run with verification and no residual risks",
  "changed_files": [
    {
      "path_label": "./src/foo.py",
      "path_hash": "sha256:3aef59f462f1ba71ec1449d98ca7f04d449c942a51ac5f821ed93198322acbac"
    }
  ],
  "verification": [
    {
      "kind": "command",
      "command_hash": "sha256:42cc940e0158657a61bc8a9dc32887a1451be517663e4df854dc6324b9e5f256",
      "status": "passed",
      "excerpt": "all checks pass"
    }
  ],
  "residual_risks": []
}
